{"candidate_count": 5, "conflicted_hypotheses": 0, "dataset_id": "prototype-return-shape-replays", "format": "REVENGINSTR.FunctionPrototypeEvaluation/2", "function_prototype_hypotheses_sha256": "b759f00647e0377984ea153066837a7f036b623d15654660a11dd25db587560b", "functions_evaluated": 3, "gold_artifact_sha256": "c77d916044fc8d74907064fc2a33fd45dbabb106a285b687fa0162d9080722ac", "high_confidence_candidate_compatibility": null, "high_confidence_candidate_count": 0, "high_confidence_compatible_candidates": 0, "high_confidence_function_count": 0, "high_confidence_function_coverage": 0.0, "hypotheses_missing": 0, "hypotheses_present": 3, "hypothesis_conflict_rate": 0.0, "minimum_confidence": 0.95, "per_property": {"parameter_count": {"accuracy": 1.0, "compatible": 5, "coverage": 1.0, "known_accuracy": 1.0, "scored": 5, "unknown": 0}, "parameters": {"accuracy": 0.6, "compatible": 3, "coverage": 0.6, "known_accuracy": 1.0, "scored": 5, "unknown": 2}, "return_value": {"accuracy": 0.6, "compatible": 3, "coverage": 0.6, "known_accuracy": 1.0, "scored": 5, "unknown": 2}}, "split_id": "ghidra12.1.2-x86-32-x86-64-v1", "top_candidate_compatibility": null}
