{"candidate_count": 3, "conflicted_hypotheses": 0, "dataset_id": "ghidra-tail-call-return-source", "format": "REVENGINSTR.FunctionPrototypeEvaluation/2", "function_prototype_hypotheses_sha256": "6d8caec26e62557e71ec42b1e304cf432bc93b02468f18f674c9b133ec6d0393", "functions_evaluated": 2, "gold_artifact_sha256": "e97935e6f0e23abd7a6b3a2206f1d4deb2669d75a4b5404f1c01c85e852813ed", "high_confidence_candidate_compatibility": null, "high_confidence_candidate_count": 0, "high_confidence_compatible_candidates": 0, "high_confidence_function_count": 0, "high_confidence_function_coverage": 0.0, "hypotheses_missing": 0, "hypotheses_present": 2, "hypothesis_conflict_rate": 0.0, "minimum_confidence": 0.95, "per_property": {"parameter_count": {"accuracy": 1.0, "compatible": 3, "coverage": 1.0, "known_accuracy": 1.0, "scored": 3, "unknown": 0}, "parameters": {"accuracy": 0.3333333333333333, "compatible": 1, "coverage": 0.3333333333333333, "known_accuracy": 1.0, "scored": 3, "unknown": 2}, "return_value": {"accuracy": 0.6666666666666666, "compatible": 2, "coverage": 0.6666666666666666, "known_accuracy": 1.0, "scored": 3, "unknown": 1}}, "split_id": "x86-32-gcc16.2.1-ghidra12.1.2-v1", "top_candidate_compatibility": null}
