{"candidate_count": 2, "conflicted_hypotheses": 0, "dataset_id": "ghidra-indirect-call-return-source", "format": "REVENGINSTR.FunctionPrototypeEvaluation/2", "function_prototype_hypotheses_sha256": "46cb5b3083699996e7492350a2c05e23313a688c2a6326cd0c2af3d68dd1b605", "functions_evaluated": 1, "gold_artifact_sha256": "ae24f35c9c7e7c2e6c93aeed3112c4e59bdd5d5feaa6618f80afa92c8c4f3a6e", "high_confidence_candidate_compatibility": null, "high_confidence_candidate_count": 0, "high_confidence_compatible_candidates": 0, "high_confidence_function_count": 0, "high_confidence_function_coverage": 0.0, "hypotheses_missing": 0, "hypotheses_present": 1, "hypothesis_conflict_rate": 0.0, "minimum_confidence": 0.95, "per_property": {"parameter_count": {"accuracy": 1.0, "compatible": 2, "coverage": 1.0, "known_accuracy": 1.0, "scored": 2, "unknown": 0}, "parameters": {"accuracy": 1.0, "compatible": 2, "coverage": 1.0, "known_accuracy": 1.0, "scored": 2, "unknown": 0}, "return_value": {"accuracy": 0.5, "compatible": 1, "coverage": 0.5, "known_accuracy": 1.0, "scored": 2, "unknown": 1}}, "split_id": "x86-64-gcc16.2.1-ghidra12.1.2-v1", "top_candidate_compatibility": null}
